{
  "schema_version": "1.0.0",
  "case_source_id": "22222222-2222-4222-8222-222222222222",
  "case_id": "11111111-1111-4111-8111-111111111111",
  "source_role": "PRIMARY_REGULATORY",
  "source_type": "FDA_WARNING_LETTER_DOCUMENT_VERSION",
  "source_system": "FDA_EVIDENCE_SERVICE",
  "source_id": "66666666-6666-4666-8666-666666666666",
  "source_version_id": "77777777-7777-4777-8777-777777777777",
  "source_hash": "aaaaaaaaaaaaaaaaaaaaaaaaaaaaaaaaaaaaaaaaaaaaaaaaaaaaaaaaaaaaaaaa",
  "trust_level": "AUTHORITATIVE_EXTERNAL",
  "authorization_snapshot_hash": "9999999999999999999999999999999999999999999999999999999999999999",
  "pinned_by_user_id": "regulatory-analyst-001",
  "pinned_at": "2026-09-04T01:01:00Z",
  "immutable": true
}
